Timeslot,1st speaker name,1st speaker handle,2nd speaker name,2nd speaker handle,3rd speaker name,3rd speaker handle,4th speaker name,4th speaker handle,talk id,Linked Sessions,Conference Events,Title,Description,Location,Session Type,Type,Start,End,Location Description,Track,Link URL,Link Text
"March 27, 2026 04:30 PM - 06:30 PM",fig,bad-example.com,bailey,baileytownsend.dev,,,,,zx4e1Oq,"at://advent, an atproto adventure","at://advent, an atproto adventure","at://advent, an atproto adventure","at://advent is an atproto adventure, teaching new explorers the ropes through a series of protocol challenges! Participants will dive in to play-test the initial set of challenges, with guidance. This will be a preview ahead of the public online release of at://advent, and will provide us with insight into what aspects are working well and what we need to improve. at://advent is about growing the atproto developer audience: we strive to make it enticing and accessible to beginner and non-devs.",2311 Classroom,Workshop,Session,"March 27th, 2026 4:30pm","March 27th, 2026 6:30pm",,Development and Protocol,,
"March 28, 2026 08:30 AM - 10:30 AM",,,,,,,,,breakfast-day-3,Breakfast Day 3,Breakfast Day 3,Breakfast Day 3,,,Info,Food,"March 28th, 2026 8:30am","March 28th, 2026 10:30am",,,,
"March 28, 2026 08:30 AM - 09:00 AM",,,,,,,,,doors-open-day-3,Doors Open Day 3,Doors Open Day 3,Doors Open Day 3,Doors Open Day 3,,Info,Info,"March 28th, 2026 8:30am","March 28th, 2026 9:00am",,,,
"March 28, 2026 09:00 AM - 09:15 AM",,,,,,,,,opening-remarks-day-3,Opening Remarks Day 3,Opening Remarks Day 3,Opening Remarks Day 3,Opening Remarks Day 3,Great Hall South,Info,Info,"March 28th, 2026 9:00am","March 28th, 2026 9:15am",,,,
"March 28, 2026 09:15 AM - 10:00 AM",Erin Kissane,kissane.myatproto.social,,,,,,,gDELD0M,Landslide,Landslide,Landslide,Keynote Day 3,Great Hall South,Presentation,Session,"March 28th, 2026 9:15am","March 28th, 2026 10:00am",,Media and Civics,,
"March 28, 2026 10:00 AM - 10:30 AM",Rudy Fraser,rude1.blacksky.team,,,,,,,QK9Ae6Y,Groundings with my Siblings: Lessons Learned Building for Community,Groundings with my Siblings: Lessons Learned Building for Community,Groundings with my Siblings: Lessons Learned Building for Community,"I had the privilege of discussing Blacksky and AT Protocol at several different college campuses, conference venues and other settings along with webinars and doing user research. I plan to share those learnings to help others build better products and how we particularly plan to incorporate those learnings from both a product and operations standpoint.",Great Hall South,Presentation,Session,"March 28th, 2026 10:00am","March 28th, 2026 10:30am",,Development and Protocol,,
"March 28, 2026 10:00 AM - 10:30 AM",Justin Bank,bankonjustin.bsky.social,,,,,,,J9yOpYz,The Aggregation Era burned journalism institutions to the ground. The federated era is emerging from those embers,The Aggregation Era burned journalism institutions to the ground. The federated era is emerging from those embers,The Aggregation Era burned journalism institutions to the ground. The federated era is emerging from those embers,Journalists are the sleeper agents to catalyze the protocol-based publishing revolution.  They're already operating in federated ways -- they just don't use those words. Whether it’s a creator spackling together a media company from web pages and discords -- like so many Twitch streamers. Or journalists using newsletter products to build direct relationships with (and monetize) the massive massive scale audiences they reach through vertical video platforms and don't monetize ....They are federating in DIY ways just as more and more media companies get smaller and more and more journalists go independent. How do we harness this natural momentum towards an organized movement? How can technologists and content creators work together to work as a federated army of Pied Pipers to port audiences into the ATmosphere.,Performance Theatre,Presentation,Session,"March 28th, 2026 10:00am","March 28th, 2026 10:30am",,Media and Civics,,
"March 28, 2026 10:00 AM - 10:30 AM",Mosh Lee,mosh.bsky.social,,,,,,,BzrpDQK,Feature / Product / Business: A Framework for Sustainable ATProto Projects,Feature / Product / Business: A Framework for Sustainable ATProto Projects,Feature / Product / Business: A Framework for Sustainable ATProto Projects,"The ATProto community built a ton of great features and products over the past year! For our next trick, let's mature them into products and businesses. In this talk, you'll get a practical framework for understanding whether what you're building should be a feature, product, or business, plus concrete funding models at each layer to keep your work going and growing. (More in this thread: https://bsky.app/profile/mosh.bsky.social/post/3mckiat2ne22q)",Room 2301,Presentation,Session,"March 28th, 2026 10:00am","March 28th, 2026 10:30am",,Development and Protocol,,
"March 28, 2026 10:30 AM - 11:00 AM",Brittany Ellich,brittanyellich.com,,,,,,,obaP26x,Who owns the group chat? Building collaborative spaces on ATProto,Who owns the group chat? Building collaborative spaces on ATProto,Who owns the group chat? Building collaborative spaces on ATProto,"Traditional social platforms centralize control of community spaces—the platform owns your group, your members, and your data. On ATProto, ownership, governance, and moderation become explicit design decisions. This talk explores building shared resources on a decentralized protocol—from data synchronization to governance models—drawing from real experience building community features and examples from other ATProto apps.",Great Hall South,Presentation,Session,"March 28th, 2026 10:30am","March 28th, 2026 11:00am",,Development and Protocol,,
"March 28, 2026 10:30 AM - 11:00 AM",Natalie Mullins,eclecticcapital.bsky.com,,,,,,,obLbvQV,Building the Sovereign Media Stack: A Roadmap for AT Protocol,Building the Sovereign Media Stack: A Roadmap for AT Protocol,Building the Sovereign Media Stack: A Roadmap for AT Protocol,"The talk will focus on (1) the structural shifts reshaping the media landscape & creator economy and provide a roadmap / suggestions for how the AT Protocol ecosystem & community can be best positioning to serve the needs of creators of all kinds (emphasis / focus here on independent creators) through this evolutio, while preserving their rights to sovereignty & ownership. The talk ideally touches on both cultural, economic and technical / infrastructural topics. Will be speaking in my capacity both as an artist and as an investor / student of media markets.",Performance Theatre,Presentation,Session,"March 28th, 2026 10:30am","March 28th, 2026 11:00am",,Development and Protocol,,
"March 28, 2026 10:30 AM - 11:00 AM",Emily Gorcenski,emily.gorcen.ski,,,,,,,gDPLaGd,Did Lexicon just accidentally solve the enterprise data problem?,Did Lexicon just accidentally solve the enterprise data problem?,Did Lexicon just accidentally solve the enterprise data problem?,"One of the core ideas behind the Data Mesh architecture is that data products should be decentralized and domain-oriented. The main barrier to successfully implementing Data Mesh is that decades of data tooling have assumed that data governance and engineering teams are centralized. ATProto’s Lexicon data definition language, however, deftly balances both the “nouns” and “verbs” of data modeling, making it a promising candidate for implementing a decentrally-managed data architecture.",Room 2301,Presentation,Session,"March 28th, 2026 10:30am","March 28th, 2026 11:00am",,Development and Protocol,,
"March 28, 2026 11:00 AM - 11:30 AM",Laurens Hof,laurenshof.online,,,,,,,ODxNLMM,This isn't over until we all listen to kpop,This isn't over until we all listen to kpop,This isn't over until we all listen to kpop,"Protocol architectures are governance structures. Their design choices allocate power, and what they leave unsaid gets filled by economics. This talk traces what happens when an open protocol's reach layer goes ungoverned, from SMTP to algorithmic convergence to why kpop fandoms are structurally destined to dominate engagement-driven systems.",Great Hall South,Presentation,Session,"March 28th, 2026 11:00am","March 28th, 2026 11:30am",,Media and Civics,,
"March 28, 2026 11:00 AM - 11:30 AM",Joe Basser,joebasser.com,,,,,,,81VNEBO,Creators First: Video & Media as the Foundation of a Thriving Creator Economy on ATProto,Creators First: Video & Media as the Foundation of a Thriving Creator Economy on ATProto,Creators First: Video & Media as the Foundation of a Thriving Creator Economy on ATProto,"This panel spotlights creators on AT Protocol and the infrastructure that lets them own their audience and income. We will explore how video, music, reviews, and other media can interoperate across apps, helping artists reach fans anywhere without being tied to a single platform. Panelists will share emerging ways creators can earn, from direct fan support to premium content. Attendees will leave with a clear view of how ATProto can become the home for the next generation of creators.",Performance Theatre,Discussion / Panel,Session,"March 28th, 2026 11:00am","March 28th, 2026 11:30am",,Media and Civics,,
"March 28, 2026 11:30 AM - 12:00 PM",fig,bad-example.com,,,,,,,7Rrv0E0,Beyond Bluesky: Community infrastructure,Beyond Bluesky: Community infrastructure,Beyond Bluesky: Community infrastructure,"Bluesky, a VC-backed company, runs public infrastructure that's widely depended upon by ATProto builders.

Microcosm, a set of community-funded open-source infra, supports dozens of ATProto projects and growing.

I'll dive into AT-protocol-specific economics of operating and scaling public infrastructure, and look ahead at how we get to a sustainable and diverse infra future. All grounded in the day-to-day reality of actually running big indexes, caches, relays, jetstreams, a PLC mirror, ...",Great Hall South,Presentation,Session,"March 28th, 2026 11:30am","March 28th, 2026 12:00pm",,Development and Protocol,,
"March 28, 2026 11:30 AM - 12:00 PM",Jim Ray,jimray.bsky.team,,,,,,,VLa69bl,Publishing Without Platforms: Building Native Media on AT Protocol,Publishing Without Platforms: Building Native Media on AT Protocol,Publishing Without Platforms: Building Native Media on AT Protocol,"The web promised independent publishing. Social media delivered distribution. AT Protocol gives you both—without surrendering control to a platform.

This session is for journalists, newsletter writers, bloggers, and media technologists who are tired of algorithmic uncertainty and want to explore what native publishing looks like on an open protocol. We'll be talking about building publishing systems where you control your content, audience relationships, and distribution strategy.",Performance Theatre,Discussion / Panel,Session,"March 28th, 2026 11:30am","March 28th, 2026 12:00pm",,Media and Civics,,
"March 28, 2026 11:30 AM - 12:00 PM",Leijie Wang,leijiew.bsky.social,,,,,,,VLerG2y,Understanding the Landscape of Custom Feeds on Bluesky,Understanding the Landscape of Custom Feeds on Bluesky,Understanding the Landscape of Custom Feeds on Bluesky,"Bluesky’s custom feeds allow users to create, govern, and share their own algorithmic feeds, shifting curation away from platform control. To understand how this ecosystem works in practice, we interviewed 26 Bluesky feed creators and third-party tool developers and analyzed 97,719 existing custom feeds. We find that hobbyist labor is central to sustaining the ecosystem, but creators face recurring challenges around maintenance, visibility, and long-term viability. Based on these findings, we lay out design implications for designing usable decentralized social media.",Room 2301,Presentation,Session,"March 28th, 2026 11:30am","March 28th, 2026 12:00pm",,Community,,
"March 28, 2026 12:00 PM - 01:30 PM",,,,,,,,,lunch-day-3,Lunch Day 3,Lunch Day 3,Lunch Day 3,Lunch Day 3,Great Hall North,Info,Food,"March 28th, 2026 12:00pm","March 28th, 2026 1:30pm",,,,
"March 28, 2026 01:30 PM - 02:30 PM",Paul Frazee,pfrazee.com,,,,,,,aQ1J9GE,2026 Atmosphere Report,2026 Atmosphere Report,2026 Atmosphere Report,"Paul Frazee, CTO of Bluesky, gives a report on the Atmosphere from Bluesky's point of view. New standards efforts, new protocol features, new developer tools and APIs - this year has it all. Paul will share what's going on, what Bluesky is working on, and why 2026 is going to be a great year for the Atmosphere.",Great Hall South,Presentation,Session,"March 28th, 2026 1:30pm","March 28th, 2026 2:30pm",,Development and Protocol,,
"March 28, 2026 01:30 PM - 02:00 PM",Sandra Barthel,sandrabarthel.bsky.social,,,,,,,QKlrLXG,Advocating for Digital Sovereignty: European Experiences and Global Lessons,Advocating for Digital Sovereignty: European Experiences and Global Lessons,Advocating for Digital Sovereignty: European Experiences and Global Lessons,"The concept of digital sovereignty has rapidly gained momentum in both Canada and Europe, reflecting growing concerns about who controls our digital infrastructure, data, and public discourse. Nowhere is this debate more dynamic than in the European Union, where lawmakers and advocacy organizations are actively shaping the future of the social web and the digital public sphere. As the founder of the Alliance of Open Networks and Democratic Public Spheres and a recent participant in the EU Summit on Digital Sovereignty, I will examine the communication strategies advocacy groups use to shape public discourse, build alliances, and engage with policymakers and the media. Attendees will understand how digital sovereignty is being debated in the EU, learn about the specific demands and advocacy tactics of European digital rights organizations, with a focus on open protocols, decentralized networks, and democratic governance. The goal of this talk is to identify opportunities for cross-border collaboration and knowledge exchange. In a year when digital policy is at the forefront of public debate, this talk offers timely, in-depth insights from the European experience, providing both inspiration and practical guidance for building a more open, decentralized, and democratic digital future.",Performance Theatre,Presentation,Session,"March 28th, 2026 1:30pm","March 28th, 2026 2:00pm",,Media and Civics,,
"March 28, 2026 01:30 PM - 02:00 PM",Matt Kane,mk.gg,,,,,,,XxP4RzL,"Building Cirrus: a single-user, serverless PDS","Building Cirrus: a single-user, serverless PDS","Building Cirrus: a single-user, serverless PDS","The reference PDS implementation is a powerful Node.js monolith designed for scale, but it's overkill for a single user who just wants to own their data. This talk introduces Cirrus, an alternative PDS built on Cloudflare Workers that scales to zero and costs pennies to run. We'll explore the technical challenges of implementing the AT Protocol in a serverless environment – you'll learn how to handle long-lived firehose connections using Durable Objects with WebSocket hibernation, and maintain repository consistency with embedded SQLite.",Room 2301,Presentation,Session,"March 28th, 2026 1:30pm","March 28th, 2026 2:00pm",,Development and Protocol,,
"March 28, 2026 02:00 PM - 02:30 PM",Ivan Sigal,ivansigal.bsky.social,,,,,,,OD2PpYA,Open social tech and geopolitical risk,Open social tech and geopolitical risk,Open social tech and geopolitical risk,"The AT Protocol was developed as a decentralized alternative to big tech; it wasn’t envisioned as a response to authoritarian state power.  Now, however, ATProto’s openness is also potentially a source of vulnerability. What are the potential threats, and how can they be countered? We’ll explore a brief history of networked authoritarianism, and consider options and strategies to manage ATProto in adversarial political environments.",Performance Theatre,Presentation,Session,"March 28th, 2026 2:00pm","March 28th, 2026 2:30pm",,Media and Civics,,
"March 28, 2026 02:00 PM - 02:30 PM",Tyler Fisher,tylerjfisher.com,,,,,,,MelQ8Ak,Rethinking the Client: Why User Choice is the Key to Growth for ATProto,Rethinking the Client: Why User Choice is the Key to Growth for ATProto,Rethinking the Client: Why User Choice is the Key to Growth for ATProto,"To grow the ATProto user base, the developer community needs to offer client experiences that surpass the Web 2.0 experience. Tyler Fisher, the creator of Sill and [Tyler's Currently Untitled Sports Client], will present the challenges and opportunities around building better clients that entice users to leave existing social platforms. Attendees will learn about strategies for building new clients on top of existing lexicons and opportunities for shared infrastructure.",Room 2301,Presentation,Session,"March 28th, 2026 2:00pm","March 28th, 2026 2:30pm",,Community,,
"March 28, 2026 02:30 PM - 03:00 PM",Eliot Hertenstein,eliot.sh,Paul Frazee,pfrazee.com,Eli Mallon,iame.li,Reed Harmeyer,reedharmeyer.bsky.social,Y561Qv6,From protocol to product: How Expo powers the next wave of AT Proto applications,From protocol to product: How Expo powers the next wave of AT Proto applications,From protocol to product: How Expo powers the next wave of AT Proto applications,"What does it actually take to build and ship an AT Proto app? This panel features developers who have done exactly that using Expo. We'll cover the full journey: authentication and OAuth, working with decentralized identity, deploying to app stores, and scaling to real users. Whether you're exploring AT Proto for the first time or ready to start building, you'll walk away with practical insights from people who've shipped.",Great Hall South,Discussion / Panel,Session,"March 28th, 2026 2:30pm","March 28th, 2026 3:00pm",,Development and Protocol,,
"March 28, 2026 02:30 PM - 03:00 PM",Joe Germuska,joe.germuska.com,Ben Werdmuller,werd.io,,,,,EkGROKB,A Free Press needs Free Protocols,A Free Press needs Free Protocols,A Free Press needs Free Protocols,"Proprietary social media platforms intermediate the two main things journalism needs to survive: attention and revenue. Drawing from our combined experience building tech for newsrooms from the Chicago Tribune to ProPublica, we'll explore how building on protocols, not platforms could create a media environment where both publishers and audiences control their own destiny. Two veteran news/open social web nerds have ideas about what this could look like in practice (and want to hear yours!)",Performance Theatre,Presentation,Session,"March 28th, 2026 2:30pm","March 28th, 2026 3:00pm",,Community,,
"March 28, 2026 02:30 PM - 03:00 PM",Cameron Pfiffer,cameron.stream,,,,,,,9qkWqPG,Building Future of Artificial Intelligence on AT Protocol,Building Future of Artificial Intelligence on AT Protocol,Building Future of Artificial Intelligence on AT Protocol,"The future of AI is collective intelligence, not a single superintelligent model. The infrastructure to support that collective already exists: portable identity, public reputation, federated coordination. 

My talk uses evidence from months of running social AI to argue that ATProtocol is uniquely suited to be the foundation for AI collective intelligence, and what I expect to come next.",Room 2301,Presentation,Session,"March 28th, 2026 2:30pm","March 28th, 2026 3:00pm",,Development and Protocol,,
"March 28, 2026 03:00 PM - 03:30 PM",Tessa Brown,tessa.germnetwork.com,,,,,,,LZxV6dv,Consent Before Cryptography,Consent Before Cryptography,Consent Before Cryptography,"In this talk, Germ Network co-founder Tessa Brown asks us to center consent in our ongoing conversations about privacy, agency, and self-determination. She describes how Germ is built for consenting connections and shares the team’s learnings from integrating atproto handles into their end-to-end encrypted messenger. As we all onboard users familiar with centralized social media paradigms into the Atmosphere, Tessa reflects on the UX design choices Germ made to help users understand what they consent to when they bring their atproto identities into Germ.",Great Hall South,Presentation,Session,"March 28th, 2026 3:00pm","March 28th, 2026 3:30pm",,Community,,
"March 28, 2026 03:00 PM - 03:30 PM",Aendra Rininsland,aendra.com,,,,,,,PdJ6Q8d,Journalism must create its own algorithms,Journalism must create its own algorithms,Journalism must create its own algorithms,"There is now an abundance of evidence that corporate social media owners are putting their thumb on the algorithmic scale. Between increasing the visibility of far-right viewpoints, shadowbanning content with external links, and the disintermediation of media orgs through AI-based summary results, it is an incredibly challenging time to be in the news business.

There is one bright spot, however: ATProto. 

Join Aendra Rininsland, creator of the News and Trending News feeds, as she discusses why it's not just possible for the media industry to create its own algorithms for news content, but also profoundly necessary for the future of quality journalism.",Performance Theatre,Presentation,Session,"March 28th, 2026 3:00pm","March 28th, 2026 3:30pm",,Media and Civics,,
"March 28, 2026 03:00 PM - 03:30 PM",Kobi Gurkan,kobi.bsky.social,,,,,,,gDP6A8N,Account logic in ATProto using Trusted Execution Environments,Account logic in ATProto using Trusted Execution Environments,Account logic in ATProto using Trusted Execution Environments,See https://www.notion.so/ATmosphere-conf-talks-2d45c481e23180008c7cf7c9551904b8?source=copy_link,Room 2301,Presentation,Session,"March 28th, 2026 3:00pm","March 28th, 2026 3:30pm",,Development and Protocol,,
"March 28, 2026 03:30 PM - 04:00 PM",,,,,,,,,day-3-coffee-break,Day 3 Coffee Break,Day 3 Coffee Break,Day 3 Coffee Break,Day 3 Coffee Break,,Info,Food,"March 28th, 2026 3:30pm","March 28th, 2026 4:00pm",,,,
"March 28, 2026 04:00 PM - 04:10 PM",Anuj Ahooja,quillmatiq.com,,,,,,,81gXlXP,State of the Multi-Protocol Social Web (name will change),State of the Multi-Protocol Social Web (name will change),State of the Multi-Protocol Social Web (name will change),"A breakdown of improvements in multi-protocol services, including Bridgy Fed and Bounce, and where those services are going in 2026. Some things include:

1. Direct integrations with platforms + client tools
2. Moderation improvements
3. Working with other multi-protocol services
4. Major updates coming to Bridgy Fed",Great Hall South,Lightning Talk,Session,"March 28th, 2026 4:00pm","March 28th, 2026 4:10pm",,Development and Protocol,,
"March 28, 2026 04:00 PM - 04:10 PM",Glenn Poppe,pop.pe,,,,,,,lbkWPeN,Oaklog: Building a community calendar in the Oakland Bay Area,Oaklog: Building a community calendar in the Oakland Bay Area,Oaklog: Building a community calendar in the Oakland Bay Area,"Our working group (oaklog.org) is collaborating with local media publications, civic organizations, community leaders, and local venues to build a digital commons for event listings in the Oakland Bay Area. We'll share findings from our work co-designing with local information stewards and how we're exploring AT Protocol as a municipal utility that makes local data reliable, accessible, and reusable across organizations and tools.",Performance Theatre,Lightning Talk,Session,"March 28th, 2026 4:00pm","March 28th, 2026 4:10pm",,Media and Civics,,
"March 28, 2026 04:00 PM - 04:10 PM",Jessie Rushing,immber.bsky.social,,,,,,,9qP16Kp,Stop Hallucinating the Protocol: Grounding your AI Agents with the Official ATproto Docs,Stop Hallucinating the Protocol: Grounding your AI Agents with the Official ATproto Docs,Stop Hallucinating the Protocol: Grounding your AI Agents with the Official ATproto Docs,"Unleash the full power of the AT Protocol documentation for your AI agents. In this lightning talk, Jessie will show you how to feed your agent the exact documentation it needs when it needs it. You will learn how to query the current official documentation through a remote MCP server, making it quicker and easier to build ATproto apps.",Room 2301,Lightning Talk,Session,"March 28th, 2026 4:00pm","March 28th, 2026 4:10pm",,Development and Protocol,,
"March 28, 2026 04:10 PM - 04:20 PM",Ronen Tamari,ronentk.me,,,,,,,OD6Gd0A,Semble: Rediscovering the Magic of Trails,Semble: Rediscovering the Magic of Trails,Semble: Rediscovering the Magic of Trails,"Attendees will discover how ATProto can power more than microblogging—it can become the foundation for a new kind of collective intelligence. We'll explore Cosmik's vision for social knowledge networks where insights don't vanish into algorithmic feeds but become discoverable, interconnected building blocks owned by the people who create them. Through a quick demo of Semble, our knowledge-sharing tool for the Atmosphere, developers will see practical patterns for building apps that leverage ATProto's interoperability to create experiences feeds were never designed for—turning passive scrolling into active sensemaking.",Great Hall South,Lightning Talk,Session,"March 28th, 2026 4:10pm","March 28th, 2026 4:20pm",,Media and Civics,,
