Timeslot,1st speaker name,1st speaker handle,2nd speaker name,2nd speaker handle,3rd speaker name,3rd speaker handle,4th speaker name,4th speaker handle,talk id,Linked Sessions,Conference Events,Title,Description,Location,Session Type,Type,Start,End,Location Description,Track,Link URL,Link Text
"March 28, 2026 04:10 PM - 04:20 PM",Stephan Noel,stephanjnoel.bsky.social,,,,,,,2EGLPML,Burning down data walls in the US Fire Service and Beyond,Burning down data walls in the US Fire Service and Beyond,Burning down data walls in the US Fire Service and Beyond,"My team at FSRI recently overhauled how all firefighters in the US report data with NERIS (https://neris.fsri.org/faqs).  I want to share insights I gained into how centralization and the resulting enshittification has played out in fire software and how NERIS hasn’t fully solved the problem.  I’d like to encourage more people to build fire (and other niche) software and create an open ecosystem of interoperable tools where fire department data ownership is at its heart and outline some opportunities and resources.
If time permits I may very quickly reference similar initiatives like FHIR and open banking.",Performance Theatre,Lightning Talk,Session,"March 28th, 2026 4:10pm","March 28th, 2026 4:20pm",,Community,,
"March 28, 2026 04:10 PM - 04:20 PM",Billy Pierce,billwpierce.co,,,,,,,QKZoLBX,"How (de)centralized is Bluesky, really?","How (de)centralized is Bluesky, really?","How (de)centralized is Bluesky, really?","In this presentation, I will discuss a working paper on the functional (de)centralization of Bluesky. This includes the extent to which AT Protocol infrastructure is owned and operated by entities other than Bluesky Social (through a computational mapping of ownership of PDS endpoints), the implications this (de)centralization has for Bluesky Social's goals, and what might be done. Following the presentation of quantitative results and associated theory, there will be time for a Q&A and discussion. Looking forward to hearing from attendees about efforts to further decentralize AT Protocol infrastructure!",Room 2301,Lightning Talk,Session,"March 28th, 2026 4:10pm","March 28th, 2026 4:20pm",,Media and Civics,,
"March 28, 2026 04:20 PM - 04:30 PM",Victoria White,buildwithtori.com,,,,,,,2EG4YMj,"What 350,000 users taught me about growing on Open Social","What 350,000 users taught me about growing on Open Social","What 350,000 users taught me about growing on Open Social","In nine months, we grew Skylight Social from zero to over 350,000 downloads. This lightning talk distills the most important lessons from that journey; how to message open social to a broader audience, how to read user behavior over user requests, and which tools and collaborations actually scaled. It’s a practical look at what worked, what didn’t, and what I’d do again if I were starting today.",Great Hall South,Lightning Talk,Session,"March 28th, 2026 4:20pm","March 28th, 2026 4:30pm",,Community,,
"March 28, 2026 04:20 PM - 04:30 PM",Hypha Coop,hypha.coop,,,,,,,7Rr2zW6,Pollen: Prototyping a toolkit for journalists and researchers to restore source transparency in an AI-saturated feed,Pollen: Prototyping a toolkit for journalists and researchers to restore source transparency in an AI-saturated feed,Pollen: Prototyping a toolkit for journalists and researchers to restore source transparency in an AI-saturated feed,"Pollen is a technical prototype by Hypha that enables journalists and researchers to anchor authenticated claims, such as photographer attribution and trusted timestamps, directly to their Personal Data Server. By attending this session, media professionals will learn how authenticated claims can protect the integrity of their reporting against generative AI ""slop"" and how a shared provenance layer empowers the community to collectively maintain digital facticity.",Performance Theatre,Lightning Talk,Session,"March 28th, 2026 4:20pm","March 28th, 2026 4:30pm",,Media and Civics,,
"March 28, 2026 04:20 PM - 04:30 PM",Jennifer Mitchell,jennie-gander.bsky.social,,,,,,,Bzr448Q,Why Gander Social?,Why Gander Social?,Why Gander Social?,A lightening talk showcasing Gander Social. Why we exist and how we interoperate.,Room 2301,Lightning Talk,Session,"March 28th, 2026 4:20pm","March 28th, 2026 4:30pm",,Development and Protocol,,
"March 28, 2026 04:30 PM - 05:00 PM",Chad Fowler,chadfowler.com,,,,,,,OD2G9j8,The Phoenix Architecture,The Phoenix Architecture,The Phoenix Architecture,"Phoenix Architecture is a way of thinking about software in a world where implementations can be rewritten faster than they can be understood. As AI shifts the economics from maintenance to regeneration, the real architectural questions move upstream: what must remain stable, what can safely change, and what breaks humans when it breaks at all. This talk offers a set of lenses (not answers) for reasoning about durability, trust, and coherence in long-lived systems. Attendees should leave with new instincts, sharper questions, and a sense that some of our deepest assumptions about software may need to be revisited.",Great Hall South,Presentation,Session,"March 28th, 2026 4:30pm","March 28th, 2026 5:00pm",,Development and Protocol,,
"March 28, 2026 04:30 PM - 05:00 PM",Sebastian Vogelsang,sebastian.eurosky.social,,,,,,,ja4ooAa,Building Public-Interest Infrastructure on ATProto,Building Public-Interest Infrastructure on ATProto,Building Public-Interest Infrastructure on ATProto,"Eurosky is a European initiative building shared ATProto infrastructure operated under EU law: PDS, relays, AppView capacity, and protocol-level moderation services. This talk explains why social media must be treated as critical infrastructure, how self-certifying data enables real separation of powers, and how a shared-cost moderation model lets independent developers comply with diverse legal regimes without central platform control.",Performance Theatre,Presentation,Session,"March 28th, 2026 4:30pm","March 28th, 2026 5:00pm",,Media and Civics,,
"March 28, 2026 04:30 PM - 04:40 PM",Robin Berjon,robin.berjon.com,,,,,,,ZjMOl7o,Matadata! Publishing scientific data straight to AT,Matadata! Publishing scientific data straight to AT,Matadata! Publishing scientific data straight to AT,Project Matadata is a project to publish and read science metadata directly to AT. This makes scientific data accessible in verified ways and widely disseminated.,Room 2301,Lightning Talk,Session,"March 28th, 2026 4:30pm","March 28th, 2026 4:40pm",,Development and Protocol,,
"March 28, 2026 04:30 PM - 04:40 PM",Paul Syverson,psyverson.bsky.social,,,,,,,000Syverson,Paul Syverson Lightning Talk,Paul Syverson Lightning Talk,Paul Syverson Lightning Talk,TBD,Room 2301,Lightning Talk,Session,"March 28th, 2026 4:30pm","March 28th, 2026 4:40pm",,Development and Protocol,,
"March 28, 2026 04:40 PM - 04:50 PM",Jer Miller,jeremie.com,,,,,,,000Jer,The Future of Open Source is Social,The Future of Open Source is Social,The Future of Open Source is Social,"open source changed the world, but now it’s stuck in the age of pull requests and gatekeepers. what happens when you build it on a social protocol instead? (and complimentary to tangled) jeremie miller — creator of XMPP (the protocol behind whatsapp, zoom, and billions of daily messages) and bluesky board member — will demo something new built entirely on AT Protocol that reimagines how open source software gets discovered, shared, and trusted. this one’s going to break some brains.",Room 2301,Lightning Talk,Session,"March 28th, 2026 4:40pm","March 28th, 2026 4:50pm",,Development and Protocol,,
"March 28, 2026 04:50 PM - 05:00 PM",Mike McCue,mmccue.bsky.social,,,,,,,81Xovjr,Feeds Are The New Websites,Feeds Are The New Websites,Feeds Are The New Websites,"How can we bring the open social web to millions more people? In 2 minutes, we'll show you how to curate content and create community that others can engage with from anywhere. Let's decentralize custom feeds and make them as easy to find and engage with as a website.",Room 2301,Lightning Talk,Session,"March 28th, 2026 4:50pm","March 28th, 2026 5:00pm",,Community,,
"March 28, 2026 05:00 PM - 05:30 PM",Blaine Cook,blaine.bsky.social,,,,,,,rj8Xv62,This Title Left Intentionally Blank,This Title Left Intentionally Blank,This Title Left Intentionally Blank,"Just putting up the offer to host a talk, or do a panel, or whatever makes sense. I could imagine another ""how to think about this stuff"" style talk, or a panel discussion about small communities on atproto, or a talk about experiences building on atproto, or a talk about roundabout specifically (with the caveat that we're not on the public PLCs)",Great Hall South,Presentation,Session,"March 28th, 2026 5:00pm","March 28th, 2026 5:30pm",,Media and Civics,,
"March 28, 2026 05:00 PM - 05:30 PM",Holke Brammer,holke.xyz,,,,,,,J9EgEdX,"Hypercerts on ATProto: Collective Funding, Evaluation, and Ownership as Social Data","Hypercerts on ATProto: Collective Funding, Evaluation, and Ownership as Social Data","Hypercerts on ATProto: Collective Funding, Evaluation, and Ownership as Social Data","This talk introduces hypercerts as a primitive for collective funding. It shows how activities, evidence, and plural evaluations can be published as durable records without relying on centralized platforms or single metrics. Attendees will learn how ATProto’s identity, record, and graph model enables new allocation mechanisms in which information production is endogenous and reusable across applications. The session connects protocol architecture with real-world funding workflows, offering concrete patterns others can adapt for funding public goods and collective action.",Performance Theatre,Presentation,Session,"March 28th, 2026 5:00pm","March 28th, 2026 5:30pm",,Development and Protocol,,
"March 28, 2026 05:00 PM - 05:30 PM",Eli Mallon,iame.li,,,,,,,RGqppqd,How Streamplace Works: VODs,How Streamplace Works: VODs,How Streamplace Works: VODs,"Here's a hard-won lesson from a video engineer: if you're gonna do both livestreaming and VOD, do livestreaming first, it's harder. And hey, livestreaming is working pretty good. Here's how we're going to do VOD, and here's why the architecture looks pretty much like building a globally-distributed fleet of atproto PDS and Relays. And here's how you can join!",Room 2301,Presentation,Session,"March 28th, 2026 5:00pm","March 28th, 2026 5:30pm",,Development and Protocol,,
"March 28, 2026 05:30 PM - 05:45 PM",,,,,,,,,day-3-closing-remarks,Day 3 Closing Remarks,Day 3 Closing Remarks,Day 3 Closing Remarks,,Great Hall South,Info,Info,"March 28th, 2026 5:30pm","March 28th, 2026 5:45pm",,,,
"March 29, 2026 08:30 AM - 10:00 AM",,,,,,,,,doors-open-day-4,Doors Open Day 4,Doors Open Day 4,Doors Open Day 4,Doors Open Day 4,,Info,Info,"March 29th, 2026 8:30am","March 29th, 2026 10:00am",,,,
"March 29, 2026 09:00 AM - 09:15 AM",,,,,,,,,opening-remarks-day-4,Opening Remarks Day 4,Opening Remarks Day 4,Opening Remarks Day 4,Opening Remarks Day 4,Great Hall South,Info,Info,"March 29th, 2026 9:00am","March 29th, 2026 9:15am",,,,
"March 29, 2026 09:15 AM - 10:00 AM",Zeu,zeu.dev,,,,,,,MeWBzWX,A better NPM site is possible,A better NPM site is possible,A better NPM site is possible,Keynote Day 4,Great Hall South,Presentation,Session,"March 29th, 2026 9:15am","March 29th, 2026 10:00am",,Development and Protocol,,
"March 29, 2026 10:00 AM - 10:30 AM",Lewis Torrington,lewis.moe,,,,,,,VLgVWM6,tangled: The Lewis end,tangled: The Lewis end,tangled: The Lewis end,"Building a company on an open protocol is a different ballgame. In this talk I aim to cover why we decided to make Tangled a company, how we're financed, why we went this route, the challenges we faced and our plans for the future.",Great Hall South,Presentation,Session,"March 29th, 2026 10:00am","March 29th, 2026 10:30am",,Development and Protocol,,
"March 29, 2026 10:00 AM - 10:30 AM",Tyler Fisher,tylerjfisher.com,,,,,,,VLXBbzJ,How and Why News Organizations Should Build on the ATProtocol,How and Why News Organizations Should Build on the ATProtocol,How and Why News Organizations Should Build on the ATProtocol,"For decades, news organizations have chased audiences on proprietary social platforms where they have no control over how their content is delivered. The ATProtocol offers a chance for news organizations to start fresh and participate as first-class citizens in the open social web. In this panel, we will discuss strategies for getting started on ATProto as a news organization and the potential benefits of moving early.",Performance Theatre,Discussion / Panel,Session,"March 29th, 2026 10:00am","March 29th, 2026 10:30am",,Media and Civics,,
"March 29, 2026 10:00 AM - 10:30 AM",Meri Leeworthy,meri.garden,,,,,,,Mej2N5X,Making space for the Protoverse,Making space for the Protoverse,Making space for the Protoverse,"Roomy is a group messaging app that gives online communities tools for autonomous collaboration — designable spaces not just for chat, but for cultivating a web of shared understanding together.

We show how cheap, user-controlled, interoperable data on ATProto can enable online communities to channel impassioned mobilizing into sustained organizing in the shadow of Big Tech's empire.",Room 2301,Presentation,Session,"March 29th, 2026 10:00am","March 29th, 2026 10:30am",,Community,,
"March 29, 2026 10:30 AM - 11:00 AM",Devin Gaffney,devingaffney.com,,,,,,,gDPMMa1,"One Year of Graze - lessons learned funding, building, and growing in the atmosphere","One Year of Graze - lessons learned funding, building, and growing in the atmosphere","One Year of Graze - lessons learned funding, building, and growing in the atmosphere","I'll be sharing an abbreviated history of building Graze, our own product's theory of action and how it slots into our more broad theory of how the AT Protocol disrupts the existing social layer of the web. We'll move into successes and challenges with fundraising, what we learned during that process and what others should know. We'll wrap with our own theories on development in 2026, how we fully move beyond the ""skeuomorph"" era of ATProto.",Great Hall South,Presentation,Session,"March 29th, 2026 10:30am","March 29th, 2026 11:00am",,Media and Civics,,
"March 29, 2026 10:30 AM - 11:00 AM",Paul Fuxjäger,cypherhippie.bsky.social,,,,,,,jaAWVRY,Bringing Self Sovereign Identities to the Masses via ATproto (and how to maximize coherence between upcoming DID:PLC forks),Bringing Self Sovereign Identities to the Masses via ATproto (and how to maximize coherence between upcoming DID:PLC forks),Bringing Self Sovereign Identities to the Masses via ATproto (and how to maximize coherence between upcoming DID:PLC forks),"I will make the case that DID:PLC forks will inevitably emerge as the wider atproto ecosystem keeps gaining global relevance: pressure on the governance model of the identity system will increase to a point where conflicts (e.g. over which DID suspension requests should be honored and which should be ignored) cannot be easilly resolved within a ‘permissioned consortium’ (as proposed in https://atproto.com/guides/identity) anymore. It seems evident that we can only argue about WHEN this will happen, not IF it will happen.

In order to be able to maintain coherent UI experiences (without threads looking more and more broken due to different forks being used in different appviews) it seems necessary to extend the adversarial design patterns at the heart of the bluesky project (‘the company is the future adversary’) to the governance model of the underlying DID:PLC identity system: ‘the consortium will become target of future adversaries’.

Can permissionless observatory networks help?
Can we avoid using cryptoeconomics?
What other options seem useful?

During this presentation, I will present the results of my ongoing PhD research project on these questions.

---

About me:

I'm part of a small team (including Marcus Sabadello, co-author and editor of the DID specification) that started to advocate for the adoption of DIDs within ActivityPub networks back in 2018 (predating Jay Graber’s ecosystem review and the birth of the bluesky project).

https://github.com/WebOfTrustInfo/rwot9-prague/blob/master/topics-and-advance-readings/fediverse-did-integration.md

https://chaos.social/@cypherhippie/102270069807129706

Link to a (somewhat cringe) video for a grant application in 2018: https://youtu.be/UJn7cLNh_q8?t=85

Recent talk at fediday berlin:
Protocol Convergence within Open Science Communication Networks
https://fair.tube/w/p/2PEFZ5cdptsVASU4HTUakA

Upcoming presentation at fosdem:
Increasing Long Term Stability of Relations Between Fediverse Identities using SSI
https://fosdem.org/2026/schedule/event/RZRZ9P-increasing_long_term_stability_of_relations_between_fediverse_identities_using_s/",Performance Theatre,Presentation,Session,"March 29th, 2026 10:30am","March 29th, 2026 11:00am",,Development and Protocol,,
"March 29, 2026 10:30 AM - 11:00 AM",Victoria Machado de Oliveira,vicwalker.dev.br,,,,,,,WOkL11Q,How to have more non-english speaking users,How to have more non-english speaking users,How to have more non-english speaking users,"This panel will reveal some common mistakes that make it harder for your app to be used by non-English speakers around the world. Following a few tips and guidelines can help new apps avoid falling into the same problems. Expect to see some real examples from across the Atmosphere. English speakers are welcome to bring any questions, and non-English speakers are welcome to join the discussion and bring additional points of view.",Room 2301,Discussion / Panel,Session,"March 29th, 2026 10:30am","March 29th, 2026 11:00am",,Community,,
"March 29, 2026 11:00 AM - 11:30 AM",Amber Case,case.bsky.social,,,,,,,ODqQQJA,Waiting for the Future to Load,Waiting for the Future to Load,Waiting for the Future to Load,"The Future is not what you think. People trained on self driving cars or notions from the 1950s are ill-prepared to see what's actually growing behind the scenes, out of public view. It's not like anything on social media right now. It's in the cracks, almost imperceptible. 

Often it's the opposite of what's been said for years. We've stayed in this timeline for a long time. What will it take to get out of the 2010s?",Great Hall South,Presentation,Session,"March 29th, 2026 11:00am","March 29th, 2026 11:30am",,Media and Civics,,
"March 29, 2026 11:00 AM - 11:30 AM",Jonathan Warden,jonathanwarden.com,,,,,,,1AzdYWM,Bluenotes: Community Notes for ATProto,Bluenotes: Community Notes for ATProto,Bluenotes: Community Notes for ATProto,"I'll briefly demonstrate Bluenotes, a fork of the Bluesky with Community Notes. Then I'll discuss a proposed ""Open Community Notes"" standard and lexicon for Community Notes on ATProto, and discuss challenges such as preserving contributor anonymity and defending against manipulation.",Performance Theatre,Presentation,Session,"March 29th, 2026 11:00am","March 29th, 2026 11:30am",,Development and Protocol,,
"March 29, 2026 11:00 AM - 11:30 AM",Stanislas Signoud (Signez),signez.fr,,,,,,,zxRkxk8,Blousques: Case Study on the Challenges in Translating Bluesky's UI,Blousques: Case Study on the Challenges in Translating Bluesky's UI,Blousques: Case Study on the Challenges in Translating Bluesky's UI,"Translating Bluesky's user interface into French was the easy part. Making it feel ‘native’ to users is something else entirely!

I18n is common in software, yet Bluesky has specific challenges: should we translate it using gender-neutral terms? How to translate names embedded on-protocol? How to translate features not yet released, as an external, voluntary contributor?

Translating the UI is also a good way to spot what is really missing in the daily lives of non-English users of the platform.",Room 2301,Presentation,Session,"March 29th, 2026 11:00am","March 29th, 2026 11:30am",,Development and Protocol,,
"March 29, 2026 11:30 AM - 12:00 PM",Alex Komoroske,komorama.bsky.social,Mike Masnick,masnick.com,,,,,kdobWjj,A Fireside Chat on Resonant Computing: Why we wrote the manifesto and where we go from here,A Fireside Chat on Resonant Computing: Why we wrote the manifesto and where we go from here,A Fireside Chat on Resonant Computing: Why we wrote the manifesto and where we go from here,"Resonant Computing manifesto co-authors Mike Masnick (Bluesky board member, Techdirt) and Alex Komoroske (Common Tools) discuss why they felt compelled to articulate an alternative vision for computing—one that's private, plural, and prosocial. They'll explore what resonance actually means in practice, why the ATProto community is uniquely positioned to build this future, and talk about the infrastructure work to make it real.",Great Hall South,Discussion / Panel,Session,"March 29th, 2026 11:30am","March 29th, 2026 12:00pm",,Community,,
"March 29, 2026 11:30 AM - 12:00 PM",Evelyn Osman,chipnick.com,,,,,,,q4qlVLY,Community privacy in a decentralized network,Community privacy in a decentralized network,Community privacy in a decentralized network,"How we can build a community that is on ATproto with content that can be contained to users within their community boundary, a form of privacy without forcing us completely off the protocol. Rather than focusing on how to handle private data with the dimensions of access we will implement a design that functions at the appview allowing any client to see it.",Performance Theatre,Presentation,Session,"March 29th, 2026 11:30am","March 29th, 2026 12:00pm",,Development and Protocol,,
"March 29, 2026 11:30 AM - 12:00 PM",lindsay blackwell,linguangst.bsky.social,,,,,,,eqVMWz0,Content Moderation Futures,Content Moderation Futures,Content Moderation Futures,"Contemporary social media platforms wield extraordinary influence over public discourse—yet their governance practices are frequently characterized as opaque, unfair, and ineffective. While experts agree that successful content moderation is principled, consistent, contextual, proactive, transparent, and accountable, technology companies repeatedly fail to achieve these goals at scale. Drawing on participatory research with various content moderation professionals, this talk identifies structural barriers to effective platform governance and explores potential solutions. Attendees will gain a more intimate understanding of the values, challenges, and contradictions that ultimately determine how platforms are governed, including practical strategies for promoting more equitable social media futures.",Room 2301,Presentation,Session,"March 29th, 2026 11:30am","March 29th, 2026 12:00pm",,Media and Civics,,
"March 29, 2026 12:00 PM - 01:30 PM",,,,,,,,,day-4-lunch,Day 4 Lunch,Day 4 Lunch,Day 4 Lunch,Day 4 Lunch,,Info,Food,"March 29th, 2026 12:00pm","March 29th, 2026 1:30pm",,,,
"March 29, 2026 01:30 PM - 02:00 PM",Dan Abramov,danabra.mov,,,,,,,9q8ZX5Q,Social Components,Social Components,Social Components,"What if social products were remixable?Imagine you could take a social product and break it its user interface into pieces. Then imagine that you, or anyone else, could recombine those pieces in different ways, swap things out, composing and remixing experiences made and hosted by different people.We already know a way to compose UI: Components. However, we didn't have a way to compose components across products. Atmosphere gives us that way: lexicons define component contracts, records point at the endpoints, everyone uses the same data.So let's put components on the protocol! In this talk, Dan will present Inlay—an experimental browser for remixable cross-product server-driven user interfaces on the Atmosphere. You can think of it as ""React for atproto"" or like ""HyperCard for social"".Whether it's a terrible idea or a glimpse of a post-app future remains to be seen.---(Demo teaser: https://bsky.app/profile/did:plc:fpruhuo22xkm5o7ttr2ktxdo/post/3mdjhy2bofk2h)",Great Hall South,Presentation,Session,"March 29th, 2026 1:30pm","March 29th, 2026 2:00pm",,Development and Protocol,,
"March 29, 2026 01:30 PM - 02:00 PM",Govind Mohan,gov.glados.computer,,,,,,,EkexvrN,~~Compete or kill~~ Cooperate and Succeed!,~~Compete or kill~~ Cooperate and Succeed!,~~Compete or kill~~ Cooperate and Succeed!,"Products no longer need to steal another killer feature that's on another app, they can just share it! This presentation will go through a product I'm working on that uses lexicons to integrate bidirectionally with a few other applications on the protocol. Future considerations could involve collaborative UI components for a lexicon.",Performance Theatre,Presentation,Session,"March 29th, 2026 1:30pm","March 29th, 2026 2:00pm",,Development and Protocol,,
"March 29, 2026 01:30 PM - 02:00 PM",Dr. KaLyn Coghill,drkalyncoghill.blacksky.team,,,,,,,2E9XG1b,Creating a Safer Web: Blacksky's Moderation Tool,Creating a Safer Web: Blacksky's Moderation Tool,Creating a Safer Web: Blacksky's Moderation Tool,"In this presentation, I will discuss our moderation service, how we use Polis to bring the community in to make decisions on creating new labels, and some of the best practices among our volunteer moderators and Trust and Safety team. The goal is to give others (communities and developers) on the protocol some ideas to think about when spinning up their own moderation tools.",Room 2301,Presentation,Session,"March 29th, 2026 1:30pm","March 29th, 2026 2:00pm",,Community,,
